,title,author,journal,year,source,pages,volume,abstract,document_type,doi,url,affiliation,author_keywords,keywords,publisher,issn,language,note,selection_criteria,created_at,updated_at,created_by,updated_by,status
25,Monitoring of autonomic response to sociocognitive tasks duringtreatment in children with Autism Spectrum Disorders by wearabletechnologies: A feasibility study,"Di Palma, Simone and Tonacci, Alessandro and Narzisi, Antonio andDomenici, Claudio and Pioggia, Giovanni and Muratori, Filippo andBilleci, Lucia and MICHELANGELO Study Grp",COMPUTERS IN BIOLOGY AND MEDICINE,2017,Web of Science,143-152,85,"Background: Autism Spectrum Disorders (ASD) represent a heterogeneous
set of neurodevelopmental disorders characterized by impairments in
social domain, where the autonomic nervous system (ANS) plays an
important role. Several researchers have studied the ANS in ASD, during
specific cognitive or sensory stimuli while few studies have examined
response during social interactions. Wearable technologies can be very
helpful in monitoring autonomic response in children with ASD in
semi-naturalistic setting. The novelty of this study is to use such
technologies to acquire physiological signals during therapeutic
sessions supported by interactive ``serious games{''} and to correlate
the ANS response to the engagement of the child during sociocognitive
tasks for an evaluation of the treatment effect and for the
personalization of the therapy.
Method: A wearable chest belt for electrocardiographic (ECG) signal
recording was used and specific algorithms for the extraction of
clinically relevant features (Heart Rate - HR, Root Mean Square of the
Successive Differences - RMSSD and Respiratory Sinus Arrhythmia - RSA)
were developed. Sociocognitive tasks were mediated by ``serious
games{''} implemented on two tablets, which allowed a precise coding of
the behaviors of the children. A longitudinal assessment of the
physiological response of the children during six months of treatment
was performed.
Results: A link between physiological response, i.e. decrease in RMSSD
and RSA, and engagement of the children during sociocognitive tasks was
found. Longitudinal changes in the children's autonomic response,
including a decrease of RSA during the engagement throughout the
therapeutic sessions, were found.
Conclusions: These results foster the feasibility of this methodology to
be applied in a clinical setting for the monitoring of the ANS response
of children with ASD during treatment. A larger sample of patients is
needed to confirm these preliminary findings. (C) 2016 Elsevier Ltd. All
rights reserved.",Article,10.1016/j.compbiomed.2016.04.001,,"Tonacci, A (Corresponding Author), CNR, Natl Res Council Italy, IFC, Via Moruzzi 1, I-56124 Pisa, Italy.Di Palma, Simone, Univ Pisa, Pisa, Italy.Tonacci, Alessandro; Domenici, Claudio; Billeci, Lucia, CNR, IFC, Natl Res Council Italy, Inst Clin Physiol, Pisa, Italy.Narzisi, Antonio; Muratori, Filippo, Stella Maris Sci Inst, Dept Dev Neurosci, Pisa, Italy.Pioggia, Giovanni, Natl Res Council Italy, Messina, Italy.Billeci, Lucia, Univ Pisa, Dept Clin \& Expt Med, Pisa, Italy.",,Autism Spectrum Disorders (ASDs); Electrocardiogram (ECG); Wearableplatform; Heart Rate; Heart Rate Variability (HRV); Respiratory SinusArrhythmia (RSA); Monitoring; Personalization,PERGAMON-ELSEVIER SCIENCE LTD,0010-4825,English,,Pesquisas fora do escopo de interesse,"45525,73089","45600,86264",daianemuz,daianemuz,Rejected
26,Automated and scalable Computerized Assessment of Motor Imitation (CAMI)in children with Autism Spectrum Disorder using a single 2D camera: Apilot study,"Lidstone, Daniel E. and Rochowiak, Rebecca and Pacheco, Carolina andTuncgenc, Bahar and Vidal, Rene and Mostofsky, Stewart H.",RESEARCH IN AUTISM SPECTRUM DISORDERS,2021,Web of Science,,87,"Background: Motor imitation difficulties are pervasive in children with
Autism Spectrum Disorder (ASD). Previous research demonstrated the
validity and reliability of an algorithm called Computerized Assessment
of Motor Imitation (CAMI) using 3D depth cameras. However, incorporating
CAMI into serious games and making it accessible in clinic and home
settings requires a more scalable approach that uses ``off-the-shelf{''}
2D cameras.
Method: In a brief (one-minute) task, children (23 ASD, 17 typically
developing {[}TD]) imitated a model's dance movements while
simultaneously being recorded using Kinect Xbox motion tracking
technology (Kinect 3D) and a single 2D camera. Pose-estimation software
(OpenPose 2D) was used on the 2D camera video to fit a skeleton to the
imitating child. Motor imitation scores computed from the fully
automated OpenPose 2D CAMI method were compared to scores computed from
the Kinect 3D CAMI and Human Observation Coding (HOC) methods.
Results: Motor imitation scores obtained from the OpenPose 2D CAMI
method were significantly correlated with scores obtained from the
Kinect 3D CAMI method (r(40) = 0.82, p < 0.001) and the HOC method
(r(40) = 0.80, p < 0.001). Both 2D and 3D CAMI methods showed better
discriminative ability than the HOC, with the Kinect 3D CAMI method
outperforming the OpenPose 2D CAMI method (area under ROC curve (AUC):
AUC(HOC) = 0.799, AUC(2D-CAMI) = 0.876, AUC3(D-CAMI )= 0.94). Finally,
all motor imitation scores were significantly associated with the
socialcommunication impairment (all p <= 0.003).
Conclusions: This pilot-study demonstrated that motor imitation can be
automatically quantified using a single 2D camera.",Article,10.1016/j.rasd.2021.101840,,"Lidstone, DE (Corresponding Author), Kennedy Krieger Inst, Ctr Neurodev \& Imaging Res, Baltimore, MD 21205 USA.Lidstone, Daniel E.; Rochowiak, Rebecca; Mostofsky, Stewart H., Kennedy Krieger Inst, Ctr Neurodev \& Imaging Res, Baltimore, MD 21205 USA.Lidstone, Daniel E.; Mostofsky, Stewart H., Johns Hopkins Univ, Sch Med, Dept Neurol, Baltimore, MD 21205 USA.Pacheco, Carolina; Vidal, Rene, Johns Hopkins Univ, Math Inst Data Sci, 3400 N Charles St, Baltimore, MD 21218 USA.Pacheco, Carolina; V",,Autism; Imitation; Intervention; Social behavior; OpenPose,ELSEVIER SCI LTD,1750-9467,English,,Pesquisas fora do escopo de interesse,"45525,73089","45586,74197",daianemuz,daianemuz,Rejected
27,"Transactional relationships between maternal requesting andresponsivity, adolescent compliance, and task demands in fragile Xsyndrome","Fielding-Gebhardt, Heather and Brady, Nancy and Bredin-Oja, Shelley L.and Warren, Steven F.",RESEARCH IN DEVELOPMENTAL DISABILITIES,2023,Web of Science,,134,"Background: Males with fragile X syndrome (FXS) may have difficulty with
social communication and language in addition to behavioral concerns
such as noncompliance to maternal requests. Mothers vary in how they
pose requests to their children, and contextual demands may also be a
factor in compliance. This study examined the relationships between
maternal requesting be-haviors, maternal responsivity, child compliance,
and task demands in adolescent males with FXS.Methods: 35 mother-son
dyads completed three interactive tasks during in-home visits (puzzle,
iPad games, snack). The adolescents also completed assessments of
language and autism symp-toms. The three interactive tasks were
video-recorded, and behavior-by-behavior coding and transcription was
completed.Results: Comparing between tasks, mothers requested a behavior
most often during the snack task and used a higher proportion of
indirect requests during the iPad task. Adolescents were largely
compliant across tasks, with average compliance equal to 70\%.
Adolescent compliance was predicted by maternal request frequency such
that mothers who used more requests had adolescent sons who were less
compliant. Maternal responsivity was higher for mothers of ado-lescents
with FXS-only compared to those with FXS and high autism
symptoms.Conclusions and implications: Task demands may have influenced
maternal requesting, which in turn may have impacted adolescent
compliance. Compliance with requests is important for both social and
educational aspects of life, and further study of requesting and
compliance in FXS is needed to identify effective teaching and
behavioral intervention methods.",Article,10.1016/j.ridd.2022.104417,,"Fielding-Gebhardt, H (Corresponding Author), Univ Kansas, Schiefelbusch Inst Life Span Studies, 1000 Sunnyside Ave,DHDC 1050, Lawrence, KS 66045 USA.Fielding-Gebhardt, Heather; Brady, Nancy; Warren, Steven F., Univ Kansas, Schiefelbusch Inst Life Span Studies, 1000 Sunnyside Ave,DHDC 1050, Lawrence, KS 66045 USA.Brady, Nancy; Warren, Steven F., Univ Kansas, Dept Speech Language Hearing Sci \& Disorders, 1000 Sunnyside Ave,DHDC 3001, Lawrence, KS 66045 USA.Bredin-Oja, Shelley L., Minot State U",,Fragile X syndrome; Noncompliance; Mother -child interaction; Indirectrequests; Maternal responsivity,PERGAMON-ELSEVIER SCIENCE LTD,0891-4222,English,,Pesquisas fora do escopo de interesse,"45525,73089","45586,743",daianemuz,daianemuz,Rejected
28,Stress and Coping in Autistic Young Adults,"Cheak-Zamora, Nancy and Odunleye, Olakunle",AUTISM IN ADULTHOOD,2022,Web of Science,193-202,4,"Community brief Why is this an important issue?Few studies have examined
what autistic young adults go through as they move from childhood to
adulthood. Moving from high school to more adult duties is stressful for
all young adults. It is unclear how autistic young adults deal with
these changes. What was the purpose of this study?We wanted to better
understand the experiences, stressors, supports, and coping styles of
autistic young adults as they move from childhood to adulthood. What did
the researchers do?We asked autistic young adults to describe their
experiences, stressors, and how they cope as they age from teen years to
adulthood. Fifteen autistic young adults were interviewed through Google
Document or in-person interviews. To analyze the data, three researchers
read each interview to find ideas and experiences those young adults
shared. The researchers met many times to discuss the shared ideas and
experiences they found. Researchers discussed these ideas until they
agreed on what the main shared ideas (or themes) were. Two researchers
then reread all the interviews to match ideas with the interview quote.
What were the results of the study?Researchers found three ideas (or
themes) that all or most autistic young adults talked about. (1) Young
adults said that they felt stress in physical and emotional ways. (2)
Dealing with new responsibilities, many responsibilities, and
relationship problems were their main causes of stress. (3) Autistic
young adults said that they had different ways of dealing with their
stress. Some young adults used meditation and others played games on
their computers or phones or looked at pictures to deal with stress.
Many young adults also said that they get help from family and friends
when they are stressed out. What do these findings add to what was
already known?These findings help us better understand what stressors
autistic young adults had and how they deal with this stress. Most
studies ask caregivers questions about their young adults. Learning
about stressors and ways to deal with stress using the young adult's own
words is an addition to what we previously knew or what was published.
Furthermore, the use of Google Doc discussions to collect data is new
and was a good method of data collection. What are potential weaknesses
in the study?We only had 15 autistic young adults agree to be in the
study, and most were white and male. Young adults with severe
communication limits were not able to be in the study. How will these
findings help autistic adults now or in the future?We know more about
the ways autistic young adults feel stress and anxiety and how they deal
with it. This information can help service workers give autistic young
adults the support they need. The findings from this study can inform
new interventions and can help health care workers, support service
workers, and family members help autistic young adults deal with their
stress and provide more ways to deal with their life stress.
Introduction: Half a million autistic youth will enter adulthood over
the next decade. Support services to help youth successfully transition
into adulthood are limited and not tailored to the autistic youth and
young adult's needs. This study utilized qualitative methods to
understand how autistic young adults experience and cope with stress
during the transition to adulthood.Methods: The study recruited 15
autistic young adults aged 18-25 years. Each participant completed a
short demographic survey and individual interview. Interviews were
conducted online via Google Docs or in-person based on the participants'
preference. Three researchers organized and coded the data using a
thematic approach.Results: Based on our analysis, three themes emerged.
Within the first theme, young adults in this study described
experiencing a great deal of stress and provided examples of how it
manifested in physical and emotional ways. In the second t",Article,10.1089/aut.2021.0043,,"Cheak-Zamora, N (Corresponding Author), Univ Missouri, Sch Hlth Profess, Dept Hlth Sci, 510 Clark Hall, Columbia, MO 65211 USA.Cheak-Zamora, Nancy; Odunleye, Olakunle, Univ Missouri, Sch Hlth Profess, Dept Hlth Sci, 510 Clark Hall, Columbia, MO 65211 USA.",,stress; coping; independence; autistic young adults,"MARY ANN LIEBERT, INC",2573-9581,English,,Pesquisas fora do escopo de interesse,"45525,73089","45586,74037",daianemuz,daianemuz,Rejected
29,Designing shaking g-sensor in mobile devices for students with special needs,"Hwang, Ming-Yueh and Hong, Jon-Chao and Chuang, Chia-Yin and Kiu, Ming-Chi","Proceedings of the 11th European Conference on Games Based Learning, ECGBL 2017",2017,Scopus,278 – 284,,"Students with intellectual and/or physical disabilities frequently experience impaired logic, cognitive impairment, attention deficit disorder, poor problem solving skills, and poor social behaviors, which can result in learning frustration and decreased motivation to study. Taking these students into account, this research designed a digital mobile device application, named Fun Ocean, for a group of children between ages 6 and 12 with different levels of disability. Participants identify a list of marine animals using figure recognition techniques. Fun Ocean allows participants to interact with the iPad via finger touch and shaking the G sensor device to transfer marine animals from one iPad to another, which motivates them to learn about the defensive and offensive functions of marine animals. Participants' game behavior change on each trial was collected throughout the experiment via observation with a checklist. It was found that Fun Ocean improved the cognitive skills of the students with special needs, and enhanced their learning interest and attentiveness. Finally, complex forms of human-computer interaction in this game can aid physical coordination.",Conference paper,,https://www.scopus.com/inward/record.uri?eid=2-s2.0-85036477850&partnerID=40&md5=785072eb85b99251e09b70447c81e8ae,,Autism; Cerebral palsy; Game-based learning; Intellectual disability; Special needs,Animals; Behavioral research; Computer games; Coordination reactions; Diseases; Hand held computers; Human computer interaction; Mobile devices; Problem solving; Students; Autism; Cerebral palsy; Game-based Learning; Intellectual disability; Special needs; Education,Academic Conferences and Publishing International Limited,,English,"Cited by: 1; Conference name: 11th European Conference on Games Based Learning, ECGBL 2017; Conference date: 5 October 2017 through 6 October 2017; Conference code: 131756",Pesquisas fora do escopo de interesse,"45527,58032","45586,73602",daianemuz,daianemuz,Rejected
30,Mixed reality or LEGO game play? Fostering social interaction in children with Autism,"Sayis, Batuhan and Ramirez, Rafael and Pares, Narcis",Virtual Reality,2022,Scopus,771 – 787,26,"This study extends the previous research in which it has been shown that a mixed reality (MR) system fosters social interaction behaviours (SIBs) in children with Autism Spectrum Condition (ASC). When comparing this system to a LEGO-based non-digital intervention, it has been observed that an MR system effectively mediates a face-to-face play session between a child with ASC and a child without ASC providing new specific advantageous properties (e.g. not being a passive tool, not needing to be guided by the therapist). Considering the newly collected multimodal data totaling to 72 children (36 trials of dyads, child with ASC/child without ASC), a first goal of the present study is to apply detailed statistical inference and machine learning techniques to extensively evaluate the overall effect of this MR system, when compared to the LEGO condition. This goal also includes the analysis of psychophysiological data and allows the context-driven triangulation of the multimodal data which is operationalized by (i) video-coding of SIBs, (ii) psychophysiological data, and (iii) system logs of user-system events. A second goal is to show how SIBs, taking place in these experiences, are influenced by the internal states of the users and the system. SIBs were measured by video-coding overt behaviours (Initiation, Response and Externalization) and with self-reports. Internal states were measured using a wearable device designed by the FuBIntLab (Full-Body Interaction Lab) to acquire: Electrocardiogram (ECG) and Electrodermal Activity (EDA) data. Affective sliders and State Trait Anxiety Scale questionnaires were used as self-reports. Repeated-measures design was chosen with two conditions, the MR environment and the traditional therapy LEGO. The results show that the MR system has a positive effect on SIBs when compared to the LEGO condition, with an added advantage of being more flexible. © 2021, The Author(s).",Article,10.1007/s10055-021-00580-9,https://www.scopus.com/inward/record.uri?eid=2-s2.0-85115379231&doi=10.1007%2fs10055-021-00580-9&partnerID=40&md5=0a43eb88d31a804b7e9c9fec7934051f,,Children with Autism; Embodied interaction; Mixed reality; Multi-modal evaluation; Psychophysiology; Social initiation,Codes (symbols); Electrocardiography; Electrophysiology; Image coding; Learning systems; Mixed reality; Surveys; Video signal processing; Children with autisms; Condition; Embodied interaction; Interaction behavior; Mixed reality; Multi-modal; Multi-modal evaluation; Social initiation; Social interactions; Spectra's; Diseases,Springer Science and Business Media Deutschland GmbH,13594338,English,"Cited by: 8; All Open Access, Hybrid Gold Open Access",Pesquisas fora do escopo de interesse,"45527,58032","45586,73584",daianemuz,daianemuz,Rejected
31,Frankfurt group social communication and interaction skillstraining for children and adolescents with autism spectrum disorders; [Frankfurter gruppentraining sozialer fertigkeiten für kinder und jugendliche mit autistischen störungen],"Herbrecht, Evelyn and Poustka, Fritz",Zeitschrift fur Kinder- und Jugendpsychiatrie und Psychotherapie,2007,Scopus,33 – 40,35,"Objective: Despite the recognition of the need for group-based training programmes for children and adolescents with autistic disorders, there are only very few specific German-speaking training programmes available. Since 2003, a structured group training programme on social skills for children and adolescents with high-functioning autism or Asperger syndrome has been developed and conducted at our department. The training programme focuses on the main deficits of those disorders. Thus, the primary goal is to improve communication and interaction skills. Method: Participants are children and adolescents without significant cognitive and language delays. Principles of intervention include structured formats, combination of theoretical and practical elements, predictable rules, consideration of individual difficulties, and sequential and progressive learning. Techniques range from structured games, the training of affect recognition, group activities, role play, team discussions, and feedback to homework using a newly designed manual on our group-based social skill training programme and curriculum. Generally, three groups of 5-7 participants each and of different age range (children, adolescents) meet weekly / biweekly for 1-1.5 hours (excluding the holidays). Two trainers - who change during the programme - carry out each of the sessions. Trainers meet regularly with the parents to discuss experiences and to provide details of the programme. Results: Acceptance by and satisfaction with the programme are high among participants, as is the mutual recognition of and tolerance of their respective problems. Both feedback from parents and trainers' clinical impressions indicate distinct improvement of verbalization and contact abilities. Participants seem to benefit particularly from role play. Conclusions: Quantitative measures (impressions of the participants, their parents and their trainers with regard to change in behaviour skills) suggest mounting interaction, communication, and problem-solving skills during the group treatment. An ongoing pilot evaluation also includes measurements of effects in everyday settings. Depending on the results, the training subsequently could be conducted and evaluated in groups with both pervasive developmental, as well as other psychiatric disorders. © 2007 by Verlag Hans Huber, Hogrefe AG.",Article,10.1024/1422-4917.35.1.33,https://www.scopus.com/inward/record.uri?eid=2-s2.0-33846541385&doi=10.1024%2f1422-4917.35.1.33&partnerID=40&md5=a7724078004387f13690a9ae73f8be94,,Autism; Children and adolescents; Group-based training; Manual; Social skills,"Adolescent; Asperger Syndrome; Autistic Disorder; Child; Communication; Female; Germany; Group Processes; Humans; Intelligence; Interpersonal Relations; Male; Pilot Projects; Program Evaluation; Psychotherapy, Group; Self Efficacy; Social Behavior Disorders; adolescent; affect; article; autism; child; controlled study; curriculum; group therapy; health program; human; interpersonal communication; learning; role playing; social adaptation; social interaction",,14224917,German,Cited by: 11,Pesquisas fora do escopo de interesse,"45527,58032","45586,73655",daianemuz,daianemuz,Rejected
32,Identifying the Essential Components of Strength-based Technology Clubs for Adolescents with Autism Spectrum Disorder,"Jones, Matthew and Falkmer, Marita and Milbourn, Ben and Tan, Tele and Bölte, Sven and Girdler, Sonya",Developmental Neurorehabilitation,2021,Scopus,323 – 336,24,"Background: Strength-based technology clubs for adolescents with autism spectrum disorder (ASD) have become increasingly popular; however, they remain poorly described in the literature. Before the impact and benefit of strength-based technology clubs can be measured, consistency in their design and delivery must be established. This study aimed to identify the essential components of strength-based technology clubs by exploring context, mechanisms, and outcomes of existing strength-based technology clubs. Method: Twenty-three adolescents with ASD (mean age 12.96 years, SD = 1.86, range = 10–18 years), 25 parents (mean age 46.08 years, SD = 8.27, range = 33–69 years), and 20 facilitators (mean age 27.93 years, SD = 6.55, range = 20–46 years) were purposively sampled from three established strength-based technology clubs. Data were obtained via ethnographic methods, including participant observations, interviews, and focus groups. Data analysis was underpinned by a realist evaluation, which provided the context-mechanism-outcome framework. Results: Data analysis revealed that strength-based technology clubs had four context themes (personal factors of adolescents, personal factors of facilitators, personal factors of parents, institution), three mechanism themes (activity design, strengths and abilities, environment), and three outcome themes (skill building, connection with others, emotion). Conclusion: The results highlighted the importance of understanding the personal context of adolescents, providing an individualized approach, leveraging individual interests, and modifying the environment to suit the individual. The findings contributed to defining a strength-based approach within ASD, and have demonstrated that positive outcomes can be achieved by focusing on strengths rather than deficits. Future ASD services can use the results as a framework for applying a strength-based approach. The efficacy of newly designed strength-based programs can then be tested. © 2021 Taylor & Francis Group, LLC.",Article,10.1080/17518423.2021.1886192,https://www.scopus.com/inward/record.uri?eid=2-s2.0-85102204969&doi=10.1080%2f17518423.2021.1886192&partnerID=40&md5=5ae26504df83c95215798f79384805ff,,Autism spectrum disorder; computer coding; qualitative research; strength-based approach; technology clubs; thematic analysis,Adolescent; Adult; Aged; Attitude of Health Personnel; Autism Spectrum Disorder; Child; Female; Focus Groups; Humans; Male; Middle Aged; Parents; Patient-Centered Care; Self-Help Groups; Technology; Young Adult; adolescent; adult; aged; Article; autism; child; clinical article; controlled study; crowding (area); cultural anthropology; emotion; environment; ethnography; female; human; information processing; interview; learning; learning environment; male; noise; parent; participant observation; ,Taylor and Francis Ltd.,17518423,English,Cited by: 10,Pesquisas fora do escopo de interesse,"45527,58032","45586,73627",daianemuz,daianemuz,Rejected
