,title,author,journal,year,source,pages,volume,abstract,document_type,doi,url,affiliation,author_keywords,keywords,publisher,issn,language,note,selection_criteria,created_at,updated_at,created_by,updated_by,status
33,Promoting Sleep and Balanced Screen Time among School-Aged Children withNeurodevelopmental and Mental Health Disorders: A Parent Perspective,"Blaine, Rachel E. and Bowling, April and Kaur, Raghbir and Davison,Kirsten K.",CHILDHOOD OBESITY,2021,Web of Science,329-341,17,"Background: Children with neurodevelopmental and mental health disorders
(N/MHD), such as autism spectrum, mood disorders, and anxiety, are more
likely to engage in excessive screen time, receive insufficient sleep,
and to have obesity than neurotypical peers. However, little is known
about how parents of these children approach promoting sleep and
balanced screen time.
Methods: We conducted semistructured interviews with 24 parents of
children aged 8-15 years with a diagnosis of N/MHD to assess barriers
and facilitators to promoting sleep and balanced screen time. Interviews
were transcribed, double-coded using constant comparative methods, and
summarized into themes using NVivo 11.
Results: Many parents described children's chronic sleep challenges,
often compounded by screen use and no clear solutions. When feeling
overwhelmed, some parents reluctantly reported co-sleeping or allowing
gaming devices in bed. Nearly all participants reported chronic,
occasionally severe, conflict when managing children's screen time, with
some parents experiencing opposition and physical aggression. Parents
struggled to weigh the benefits of screen use (i.e., behavior
management, learning, and social connection) with the costs (i.e.,
reduced self-care and limited physical activity). To combat barriers,
parents described firm routines (i.e., ``screens off{''} time and
consistent bedtime on weekdays and weekends), moderating access (i.e.,
shutting down internet and no device in bedroom), verbal priming, and
coping strategies (i.e., music and books).
Conclusions: Parents of children with N/MHD face unique challenges in
promoting sleep and balanced screen time. Given these behaviors may
impact weight status and mental health, future interventions should
examine ways to support parents in reducing conflict while promoting
healthy habits.",Article,10.1089/chi.2020.0335,,"Blaine, RE (Corresponding Author), Calif State Univ Long Beach, Dept Family \& Consumer Studies, 1250 Bellflower Blvd,FCS FA-15, Long Beach, CA 90840 USA.Blaine, Rachel E., Calif State Univ Long Beach, Dept Family \& Consumer Studies, 1250 Bellflower Blvd,FCS FA-15, Long Beach, CA 90840 USA.Bowling, April, Merrimack Coll, Sch Hlth Sci, N Andover, MA 01845 USA.Kaur, Raghbir, Harvard TH Chan Sch Publ Hlth, Boston, MA USA.Davison, Kirsten K., Boston Coll, Sch Social Work, Chestnut Hill, MA 0216",,autism spectrum disorder; mental health; parenting; screen time; sleep,"MARY ANN LIEBERT, INC",2153-2168,English,,Pesquisas fora do escopo de interesse,"45525,73089","45586,74144",daianemuz,daianemuz,Rejected
34,Computerized Assessment of Motor Imitation as a Scalable Method forDistinguishing Children With Autism,"Tuncgenc, Bahar and Pacheco, Carolina and Rochowiak, Rebecca andNicholas, Rosemary and Rengarajan, Sundararaman and Zou, Erin andMessenger, Brice and Vidal, Rene and Mostofsky, Stewart H.",BIOLOGICAL PSYCHIATRY-COGNITIVE NEUROSCIENCE AND NEUROIMAGING,2021,Web of Science,321-328,6,"BACKGROUND: Imitation deficits are prevalent in autism spectrum
conditions (ASCs) and are associated with core autistic traits.
Imitating others' actions is central to the development of social skills
in typically developing populations, as it facilitates social learning
and bond formation. We present a Computerized Assessment of Motor
Imitation (CAMI) using a brief (1-min), highly engaging video game task.
METHODS: Using Kinect Xbox motion tracking technology, we recorded 48
children (27 with ASCs, 21 typically developing) as they imitated a
model's dance movements. We implemented an algorithm based on metric
learning and dynamic time warping that automatically detects and
evaluates the important joints and returns a score considering spatial
position and timing differences between the child and the model. To
establish construct validity and reliability, we compared imitation
performance measured by the CAMI method to the more traditional human
observation coding (HOC) method across repeated trials and two different
movement sequences.
RESULTS: Results revealed poorer imitation in children with ASCs than in
typically developing children (ps < .005), with poorer imitation being
associated with increased core autism symptoms. While strong
correlations between the CAMI and HOC methods (rs = .69-.87) confirmed
the CAMI's construct validity, CAMI scores classified the children into
diagnostic groups better than the HOC scores (accuracy(CAMI) = 87.2\%,
accuracy(HOC) = 74.4\%). Finally, by comparing repeated movement trials,
we demonstrated high test-retest reliability of CAMI (rs = .73-.86).
CONCLUSIONS: Findings support the CAMI as an objective, highly scalable,
directly interpretable method for assessing motor imitation differences,
providing a promising biomarker for defining biologically meaningful ASC
subtypes and guiding intervention.",Article,10.1016/j.bpsc.2020.09.001,,"Tunçgenç, B (Corresponding Author), Kennedy Krieger Inst, Ctr Neurodev \& Imaging Res, Baltimore, MD 21205 USA.Tunçgenç, B (Corresponding Author), Univ Nottingham, Sch Psychol, Nottingham, England.Tuncgenc, Bahar; Rochowiak, Rebecca; Zou, Erin; Messenger, Brice; Mostofsky, Stewart H., Kennedy Krieger Inst, Ctr Neurodev \& Imaging Res, Baltimore, MD 21205 USA.Pacheco, Carolina; Vidal, Rene, Johns Hopkins Univ, Math Inst Data Sci, Baltimore, MD USA.Pacheco, Carolina; Vidal, Rene, Johns Hopkins",,,ELSEVIER,2451-9022,English,,Pesquisas fora do escopo de interesse,"45525,73089","45586,74248",daianemuz,daianemuz,Rejected
35,Interactive Therapy Approach Through Collaborative Physical Play Betweena Socially Assistive Humanoid Robot and Children with Autism SpectrumDisorder,"Tariq, Saima and Baber, Sara and Ashfaq, Asbah and Ayaz, Yasar andNaveed, Muhammad and Mohsin, Saba",,2016,Web of Science,561-570,9979,"This paper presents an exploratory study in which children with autism
spectrum disorder (ASD) interact with a NAO humanoid robot in an
interactive football game scenario. The study was conducted during 4
sessions with three boys diagnosed with ASD. It observed improvements in
therapeutic outcomes such as social interaction, communication, eye
contact, joint attention and turn taking. Qualitative and quantitative
analysis were conducted using various approaches such as video
documenting, surveys and assessment scales. In order to establish the
efficacy of the study children interacted with their typically
developing peers and parents post intervention to relate skills learned
in robot-human setting to human-human setting. The quantitative results
gathered and analyzed from pre and post implementation showed an
increased in execution and duration of target behaviors. Manual coding
and qualitative analysis of videos also verified that the proposed robot
mediated play setting demonstrated improvements in social development of
children with ASD in areas of communicative competence, turn taking,
social interaction and proxemics and eye contact.",Proceedings Paper,10.1007/978-3-319-47437-3\_55,,"Ayaz, Y (Corresponding Author), Natl Univ Sci \& Technol, Sch Mech \& Mfg Engn, Dept Robot \& Intelligent Machine Engn, Islamabad, Pakistan.Tariq, Saima; Baber, Sara; Ashfaq, Asbah; Ayaz, Yasar; Naveed, Muhammad, Natl Univ Sci \& Technol, Sch Mech \& Mfg Engn, Dept Robot \& Intelligent Machine Engn, Islamabad, Pakistan.Mohsin, Saba, Picture Autism, NJs House, Islamabad, Pakistan.",,Socially assistive robots; Autism; ASD; Prosocial behaviors; Interactiondesign; Play therapy; Socialization; Collaborative play,SPRINGER-VERLAG BERLIN,0302-9743,English,"8th International Conference on Social Robotics (ICSR), Kansas City, MO,NOV 01-03, 2016",Pesquisas fora do escopo de interesse,"45525,73089","45600,87303",daianemuz,daianemuz,Rejected
36,Frankfurt group social communication and interaction skills training forchildren and adolescents with autism spectrum disorders,"Herbrecht, Evelyn and Poustka, Fritz",ZEITSCHRIFT FUR KINDER-UND JUGENDPSYCHIATRIE UND PSYCHOTHERAPIE,2007,Web of Science,33-40,35,"Objective: Despite the recognition of the need for group-based training
programmes for children and adolescents with autistic disorders, there
are only very few specific German-speaking training programmes
available. Since 2003, a structured group training programme on social
skills for children and adolescents with high-functioning autism or
Asperger syndrome has been developed and conducted at our department.
The training programme focuses on the main deficits of those disorders.
Thus, the primary goal is to improve communication and interaction
skills.
Method: Participants are children and adolescents without significant
cognitive and language delays. Principles of intervention include
structured formats, combination of theoretical and practical elements,
predictable rules, consideration of individual difficulties, and
sequential and progressive learning. Techniques range from structured
games, the training of affect recognition, group activities, role play,
team discussions, and feedback to homework using a newly designed manual
on our group-based social skill training programme and curriculum.
Generally, three groups of 5-7 participants each and of different age
range (children, adolescents) meet weekly / biweekly for 1-1.5 hours
(excluding the holidays). Two trainers - who change during the programme
- carry out each of the sessions. Trainers meet regularly with the
parents to discuss experiences and to provide details of the programme.
Results: Acceptance by and satisfaction with the programme are high
among participants, as is the mutual recognition of and tolerance of
their respective problems. Both feedback from parents and trainers'
clinical impressions indicate distinct improvement of verbalization and
contact abilities. Participants seem to benefit particularly from role
play.
Conclusions: Qualtitative measures (impressions of the participants,
their parents and their trainers with regard to change in behaviour
skills) suggest mounting interaction, communication. and problem-solving
skills during the group treatment. An ongoing pilot evaluation also
includes measurements of effects in everyday settings. Depending on the
results, the training subsequently could be conducted and evaluated in
groups. with both pervasive developmental, as well as other psychiatric
disorders.",Article,10.1024/1422-4917.35.1.33,,"Herbrecht, E (Corresponding Author), Klinikum Johann Wolfgang Goethe Univ, Klin Psychiat \& Psychotherapie Kindes \& Jugendalt, Deutschordenstr 50, DE-60528 Frankfurt, Germany.Klinikum Johann Wolfgang Goethe Univ, Klin Psychiat \& Psychotherapie Kindes \& Jugendalt, DE-60528 Frankfurt, Germany.",,group-based training; autism; social skills; children and adolescents;manual,VERLAG HANS HUBER,1422-4917,German,,Pesquisas fora do escopo de interesse,"45525,73089","45600,87054",daianemuz,daianemuz,Rejected
37,Applying Asymmetrical VR Collaborative Games to the Enhancement of PeerCollaboration and Oral Communication in Children with Autism,"Yang, Wan-Chen and Lee, I-Jui",,2022,Web of Science,413-426,13331,"Autism is a condition in which children are born with social impairments
in social communication, imagination, and empathy, thus, they have
difficulty interacting socially with peers or effectively interpreting
each other's intentions to engage in different social content. As a
result of these deficits, most children with autism are unable to play
cooperatively or effectively interact socially with their peers, which
makes them socially isolated and difficult to integrate into the
community.
In view of this, this study conducted an asymmetric VR collaborative
game for children with autism, where children with autism and Typical
Development (TD) children participated in a collaborative game in pairs,
and both children were required to play the game through peer
cooperation and oral communication. A total of 6 participants aged 7-9
years old, including 3 children with highfunctioning autism and 3 TD
children, were recruited for this study. During the game, social
assessments and behavioral observations were conducted by the researcher
and the therapist to understand whether the asymmetrical VR
collaborative game has an impact on children with autism in building
peer cooperation and oral communication skills, in order to achieve
outcomes that enhance social communication and trans-personal thinking
skills.
This study used an asymmetrical VR collaborative game to present the
game situation with different viewpoints, which allowed children with
autism and TD children to work together to solve the game tasks and
levels in a peer-to-peer and oral communication manner. In this game,
children with autism were required to interact socially with TD children
through an asymmetrical play style, thus, triggering the application of
peer cooperation and oral communication skills in children with autism.
In this game, the researcher used themicro-behaviors for video coding
(MBV) to observe and assess five domains, (1) mutual attention; (2)
meaningful conversation; (3) collaboration; (4) proximity; and (5) turn
taking. According to the results of this study, children with autism
exhibited behavioral orientations in the asymmetrical VR collaborative
game that were more oriented toward strengthening trans-personal and
empathic abilities than traditional solo play, especially in peer
cooperation and oral communication. On this basis, the expectation of
this study was that the application of asymmetrical VR collaborative
games had different degrees of specificity and implementation advantages
for children with autism in terms of social communication, imagination,
and empathy skills. Children with autism could learn to grasp the
meaning of others' spoken communication, and thus, develop the concept
of peer cooperation during the game, which in turn facilitated their
mastery of social skills in all aspects of the theory of the mind.",Proceedings Paper,10.1007/978-3-031-05654-3\_29,,"Lee, IJ (Corresponding Author), Natl Taipei Univ Technol, Dept Ind Design, Taipei, Taiwan.Yang, Wan-Chen; Lee, I-Jui, Natl Taipei Univ Technol, Dept Ind Design, Taipei, Taiwan.",,Autism; Asymmetrical VR collaborative game; Empathy; Peer cooperationand oral communication; Peer-mediated intervention strategies,SPRINGER INTERNATIONAL PUBLISHING AG,0302-9743,English,"8th International Conference on Human Aspects of IT for the AgedPopulation (ITAP) Held as Part of the 24th International Conference onHuman-Computer Interaction (HCII), ELECTR NETWORK, JUN 26-JUL 01, 2022",Pesquisas fora do escopo de interesse,"45525,73089","45600,86564",daianemuz,daianemuz,Rejected
38,``<i>Xylotism</i>{''}: A Tablet-Based Application to Teach Music toChildren with Autism,"Elahi, Maryam Tavakol and Korayem, Amin Habibnejad and Shariati, Azadehand Meghdari, Ali and Alemi, Minoo and Ahmadi, Ehsan and Taheri, Alirezaand Heidari, Rozita",,2017,Web of Science,728-738,10652,"Technology is inevitable, and its role for clinical therapists and
specialists cannot be ignored. The promising movement towards
computer-based interventions, specifically the use of tablets as an
effective and newly developed learning device for children with autism
spectral disorder (ASD) highlights the role of technology in addressing
the shortcomings of conventional therapy methods. In this paper, we
present a new application, named as Xylotism, which is an interactive
game to improve learning and teach music to children with autism
spectrum disorder. The game can be played with/without
parents/therapists' involvement, which increases its usefulness and
effectiveness. We have investigated the acceptability and eligibility of
the application among twenty children with autism spectrum disorder. To
have a fair comparison a similar experiment has been performed utilizing
a real Xylophone. The initial results are promising, since all
participants accepted to play with Xylotism application and fifteen out
of the twenty of them preferred to use the virtual Xylophone. We also
video recorded the activities and coded the children's behavior, and
their performance in playing rhythms were measured. The results suggest
that the acceptance of Xylotism application is fairly compatible to the
real Xylophone and it has the potential to improve the skill of playing
rhythms in children with ASD.",Proceedings Paper,10.1007/978-3-319-70022-9\_72,,"Meghdari, A (Corresponding Author), Sharif Univ Technol, CEDRA, Social \& Cognit Robot Lab, Tehran, Iran.Shariati, A (Corresponding Author), Islamic Azad Univ, North Tehran Branch, Tehran, Iran.Elahi, Maryam Tavakol; Korayem, Amin Habibnejad; Meghdari, Ali; Alemi, Minoo; Ahmadi, Ehsan; Taheri, Alireza; Heidari, Rozita, Sharif Univ Technol, CEDRA, Social \& Cognit Robot Lab, Tehran, Iran.Shariati, Azadeh, Islamic Azad Univ, North Tehran Branch, Tehran, Iran.Alemi, Minoo, Islamic Azad Univ, We",,Autism Spectrum Disorder (ASD); Xylophone; Xylotism application;Learning music,SPRINGER INTERNATIONAL PUBLISHING AG,0302-9743,English,"9th International Conference on Social Robotics (ICSR), Tsukuba, JAPAN,NOV 22-24, 2017",Pesquisas fora do escopo de interesse,"45525,73089","45600,85809",daianemuz,daianemuz,Rejected
39,DEVELOPMENT AND EFFECTIVENESS OF ``SRI BITARA{''} MODULE IN IMPROVINGLITERACY SKILL AMONG REMEDIAL CHILDREN,"Kasi, K. and Aini, B. A. Noor",,2018,Web of Science,4602-4606,,"The number of children in remedial class is increasing worldwide.
Approximately 50\% of remedial children with autism have difficulties in
developing functional language owing to communication deterioration.
There are a diverse set of prerequisite skills including both language
and literacy related skills. This research reports on ``sri bitara{''}
module which include fostering methodology of literacy, mlearning,
ubiquitous learning, 21st century learning activities, qr code for
enhancement activity, reading material in blog, augmented reality
scenario for listening and speaking skill, multiple apps to record audio
and video. This module includes both traditional method and flipped
learning method via blended learning technique. Mobile devices with
installed educational games help these individuals feel more comfortable
and relaxed doing such activities. Although numerous mobile applications
are available for children, they are difficult to use; particularly in
terms of user-interface design. This study analyzed the existing apps in
order to determine the design principles applicable to the edutainment
app being studied. As outlined in the objectives of this study,
identifying these design principles is important in designing the ``sri
bitara{''} module. These recommendations are offered by this study
towards designing and developing ``sri bitara{''} module for remedial
children. This study introduces blended learning method and an
edutainment-system design principle formulated to help develop the
literacy skills of children with blended learning. This study also
describes the design, implementation, and evaluation of the ``sri
bitara{''} module that can be used to improve users' understanding and
literacy skills and help them to connect with society and the
surrounding environment particularly for remedial children with
communication difficulties.",Proceedings Paper,,,"Kasi, K (Corresponding Author), Univ Pendidikan Sultan Idris, Tanjung Malim, Malaysia.Kasi, K.; Aini, B. A. Noor, Univ Pendidikan Sultan Idris, Tanjung Malim, Malaysia.",,Literacy skill; Remedial children; Blended learning,IATED-INT ASSOC TECHNOLOGY EDUCATION \& DEVELOPMENT,2340-1117,English,"10th International Conference on Education and New Learning Technologies(EDULEARN), Palma, SPAIN, JUL 02-04, 2018",Artigo completo não disponível online e/ou gratuitamente,"45525,73089","45600,00088",daianemuz,daianemuz,Rejected
40,Automated vs Human Recognition of Emotional Facial Expressions ofHigh-Functioning Children with Autism in a Diagnostic-TechnologicalContext: Explorations via a Bottom-Up Approach,"Gyori, Miklos and Borsos, Zsofia and Stefanik, Krisztina and Jakab,Zoltan and Varga, Fanni and Csakvari, Judit",,2018,Web of Science,466-473,10896,"Early detection of autism spectrum conditions (ASC) is an important
goal. Automated facial expression recognition is a promising approach
and has implications for assistive and educational technologies, too.
This study was an initial exploration of (1) the inter-rater reliability
of human recognition of facial emotions of high functioning (HF)
children with ASC; (2) the relationship between human and automated
recognition of facial emotions; and (3) a `bottom-up' approach on
identifying ASC/typical development (TD) differences, from a screening
serious game context. Thirteen HF, kindergarten-age children with ASC
and 13 children with TD, matched along age and IQ, participated. Emotion
recognition was administered on video-recordings from sessions of their
playing with the serious game. Results showed lack of inter-rater
reliability in human coding, confirming some advantages of machine
coding. The simple bottom-up cross-sectional exploratory analysis did
not reveal any ASC/TD difference. This is in contrast with our and
others' previous results, indicating such differences when aggregating
emotion data from wider time-windows in machine-coded data-sets. This
suggests that this second approach may be a more promising one to
identify autism-specific emotion expression patterns.",Proceedings Paper,10.1007/978-3-319-94277-3\_72,,"Gyori, M (Corresponding Author), ELTE Univ, Ecseri Rd 3, H-1097 Budapest, Hungary.Gyori, M (Corresponding Author), MTA ELTE Autism Educ Res Grp, Ecseri Rd 3, H-1097 Budapest, Hungary.Gyori, Miklos; Borsos, Zsofia; Stefanik, Krisztina; Jakab, Zoltan; Varga, Fanni; Csakvari, Judit, ELTE Univ, Ecseri Rd 3, H-1097 Budapest, Hungary.Gyori, Miklos; Borsos, Zsofia; Stefanik, Krisztina, MTA ELTE Autism Educ Res Grp, Ecseri Rd 3, H-1097 Budapest, Hungary.",,Autism spectrum conditions; Emotional facial expressions; Screening;Serious game,SPRINGER INTERNATIONAL PUBLISHING AG,0302-9743,English,"16th International Conference on Computers Helping People with SpecialNeeds (ICCHP), Univ Linz, Linz, AUSTRIA, JUL 11-13, 2018",Pesquisas fora do escopo de interesse,"45525,73089","45599,98691",daianemuz,daianemuz,Rejected
41,A pilot study using imitation and storytelling scenarios as activities for labelling emotions by children with autism using a humanoid robot,"Costa, Sandra and Soares, Filomena and Pereira, Ana Paula and Santos, Cristina and Hiolle, Antoine",,2014,IEEE Digital Library,299-304,,"In this paper we present a child-robot interaction pilot study, focusing on recognizing and labelling emotions displayed by a humanoid robot. ZECA (Zeno Engaging Children with Autism) has a special skin covering its face which allows the display of facial expressions representing five emotions: joy, sadness, fear, anger, and surprise. These facial expressions were used in two different game scenarios, involving imitation and storytelling activities. The goal of these scenarios is to help the child acquire knowledge about different emotions and to improve their skill in recognizing them. The results show that these scenarios are appropriate for the goal established for this study, and positive behaviours concerning non-verbal communication were observed. This exploratory study demonstrated the possible positive outcomes this child-robot interaction can produce and highlighted the issues regarding data collection and their analysis that will inform future studies.",,10.1109/DEVLRN.2014.6982997,,,,Variable speed drives;Games;Face;Emotion recognition;Labeling;Humanoid robots,,2161-9476,,,Pesquisas fora do escopo de interesse,"45525,65922","45593,79007",daianemuz,daianemuz,Rejected
42,An emotional learning environment for subjects with Autism Spectrum Disorder,"Bertacchini, Francesca and Bilotta, Eleonora and Gabriele, Lorella and Olmedo Vizueta, Diana Elizabeth and Pantano, Pietro and Rosa, Francesco and Tavernise, Assunta and Vena, Stefano and Valenti, Antonella",,2013,IEEE Digital Library,653-659,,"Numerous studies highlight that serious games, 3D virtual learning environments and Information Communication Technologies can be powerful tools in supporting people affected by Autism Spectrum Disorders. In particular, they can be very effective in helping to recognize and comprehend social behaviours and emotions. In this paper, an authoring system designed and implemented in order to stimulate and to facilitate the understanding of emotions is presented (Face 3D). This software could be a highly appropriate tool for autistic children with high cognitive functions, who are often attracted by technology.",,10.1109/ICL.2013.6644675,,,,Autism;Educational institutions;Three-dimensional displays;Facial animation;Software;Emotion recognition;Face;Emotions;learning;autism;learning by doing;emotional learning environment;teaching/learning strategies;improving classroom teaching;multimedia/hypermedia systems;advanced learning environments,,,,,Pesquisas fora do escopo de interesse,"45525,65922","45593,77523",daianemuz,daianemuz,Rejected
